,ulevel,comment,score,uname,uid,score_predict
2544,6,麻鸭居然有这么多1星哈哈哈 但是这部电影给我的感觉 就像是给那些曾经经历过伤痛的人一个温暖的拥抱 你们曾经痛过 但未来并不一定是可怕的 时间会抚平伤口 积极勇敢的向前迈步吧 祝愿大家都能平安顺遂,10,重生之狂啾奶茶,7842229,9.999998197905493
2545,4,最快二刷,10,狂热的鱼雷,1001789436,6.043661544012333
2546,6,重点在于灾难带来的情感（男主人设）与记忆（女主设定），别的都是为这个而服务的，有些强行也不奇怪。也只有身为少年的主角才能推动这种剧情。女主有责任心又美丽善良，相处着有好感也正常。设定和情节能自圆其说。,10,uni_limited,336127460,3.923794058248391
2547,5,表白铃芽草太,10,弔金,611095808,2.7511190750411907
2548,5,看了评论区吓一跳那么多差评的，但是群众眼睛雪亮的，9.8分说明是好电影。就要给五星,10,海瑟薇e,230416648,1.164439608123622
2549,4,个人感觉挺好的,10,bili_68145385784,696295164,8.54949121312232
2550,5,一颗给画面，一颗给音乐，一颗给设定,6,编号94846,1433842716,3.454504691982253
2551,6,实在是...,4,妩潋,151224331,3.87391236949692
2552,5,好看！！爱看,10,小甘大大,455191494,8.703487547210191
2553,5,nice，很棒！,10,哦吼是阿啾,349000744,9.87741015056507
2554,5,在我心里唯一的败笔是“没有草太我什么都做不了”，感情线有点仓促，其他的我真的很喜欢，大臣也好，姨妈也好，一路上遇见的大家都好，都非常棒，很温柔。和过去说再见吧，你有很好的明天。,8,椋月tsuki,470478239,9.99621576607836
2555,6,不枉三年之约,10,火箭莱拉板板大牙,348816116,9.529623551601176
2556,5,非常好作品，使我的眼泪流淌,10,彧玖er,480749713,9.982075446646196
2557,4,神!,10,勿-忘-初-心-,517525330,7.2634722410750605
2558,5,画面还是好看的,6,都别吵架和平一点,36114916,8.28241337305174
2559,6,挺好，整体观感挺舒服的，除过有些设定没来的及展开，部分情节节奏发展的太快和铃芽有几句比较尬的喊话这些问题之外，看的挺开心的。是个不错的爆米花电影,8,洛丝夫someone,295591163,0.03809594903794289
2560,5,害怕,10,很会起名真菌,2000641692,8.563636363636359
2561,4,来部分啦 为啥都说不好看啊 我觉得很好啊,10,骑着猪看美洋洋,543971068,5.7070513482833904
2562,4,影院看过，来打个分,8,我是你的破壁人y,629353761,4.866487218037769
2563,5,首先，结合小说看的话效果更好因为小说中有更多的心理描写我认为电影写了自然灾害对于人们的伤害，曾经繁荣的地方边的荒无人烟，铃芽的经历也是其他遇难者的经历，很令人心痛，最后对小铃芽的话也是对遇难者的鼓励,10,千与__-,336108369,9.99882969677836
2564,6,还可以吧，只能说画面很精美，剧情有点勉强,8,山风水清,33448814,2.2101688356638363
2565,4,太感动了,10,CRH380AM-_-0204,1294007160,9.13096440738258
2566,4,不管看了多少遍，还是很好看呜呜呜,10,是缅因不是橘座,1321650174,8.432031555293467
2567,5,当初在电影院看的，好看,10,瀚海孤帆i,564774556,5.667522690064606
2568,6,终于能线上看到这部电影了！！总结一句话就是你可以永远相信诚哥！！,10,黄桃罐头干,18427816,8.777173441816696
2569,6,女主行为扣一分,8,索宁5,149927479,5.098748614443944
2570,6,其实不错了，音乐美术不用多说，只是作为新海诚，差了点剧情，篇幅拉长一点讲明白设定就好了。,10,做个纸灯,162417042,0.2860627396124604
2571,5,音乐 绘画,6,请叫我羽千,503176213,9.62528230682371
2572,5,两星给画风，两星给配乐，一星给辛苦作画的工作人员，感情线倒扣一星，缺少代入感的世界观倒扣一星，（考虑到b站还有某些特别烂的番也能达到6分），综合打三星，评价为质量配不上出圈热度,6,记忆_零,1926229758,8.565328055709642e-06
2573,5,可以的！,10,一知绘熊,670109862,7.484223051105047
2574,5,哇哇哇，新海诚还是一如既往的nb,10,你滴小刘,525800805,9.192391184544968
2575,6,一如既往的算是一部视听体验不错的电影，虽然恋爱线有点略显唐突，但还能接受,10,离洛沧,417409705,9.185377009967606
2576,5,其实还可以,8,Meow栀離丶,450294537,6.799550307602083
2577,4,すずめ！！,10,好似龙年狂,1480924500,5.0
2578,6,这能有9.8分？,4,樱鱼,29293455,7.604302686109813
2579,6,个人觉得其实很不错。但是周围的朋友们好像都不太喜欢。应该是个人口味原因吧,10,imdumbass,35331179,9.2456581944451
2580,4,有些事物还得细细品味才理解含义，反复看了好几遍的我不可否认它给我带来的启发和影响,10,艾米利亚碳糖糖,506967875,9.999557105149636
2581,5,。。。。。。,2,轩某不好色,620238963,4.710982658959529
2582,4,语言不足以表达震撼的心情,10,无雪的痕迹,1621958324,9.755306580755171
2583,5,太酷辣,10,带善人叶猫,499175063,3.2953531561773963
2584,4,没有乐子的世界,4,玄焰灵汐,623692071,8.68614172122889
2585,5,剧情比较一般,6,言宁午忆,397757969,5.437612642805002
2586,4,很好看哦！！,10,繁星御梦,553442345,8.610595139823534
2587,5,思子咩！亚撒西！suki!,10,親愛的瑞秋,433898762,3.8768303258974948
2588,6,期待下个三年,10,はやしじょう,90296414,8.646868506023184
2589,5,新海诚无敌,10,勉強の天井,354190232,8.216040878214754
2590,6,《关于只是在废墟开了一扇门，结果差点毁灭日本，为了解决这一切，在半个日本旅行的这件事》,10,胡言乱语我无法理解,297352,9.873634041828602
2591,6,当时电影院看的，剧情真的很一般，其他也就那样,4,一只扇扇,21834522,3.875359108735257
2592,5,电影院看的时候真的震撼到了，绝对不输前两部,10,青麟砚,436124771,9.786024118523343
2593,4,画面五分，情感线有点乱三分，平均四分吧,8,想死在二次元里,650588117,6.582176312869322
2594,6,bgm神中神！！！几个镜头太震撼了，比预期好很多，爱情线虽然弱但是只是添头，亲情线非常好，猫好！,10,-宅鱼鱼-,9013203,9.957499701936092
2595,5,剧情有点难评，视听效果很牛,6,喧_吖,495011079,5.5697494668800305
2596,5,最感触的一部,10,揽星河入瞳梦,291188869,9.609675728530448
2597,6,今年最喜欢的电影，电影院的音效实在太好了,10,seulatter,27957629,6.203631383191012
2598,5,在电影院看过一遍，确实视效还是要去影院，剧情还不错，除了感情线有一点突兀别的都处理的还可以，主打救赎吧，电影主旨体现了对灾难幸存者的鼓励，这点还是很值得夸的。最喜欢的是公路部分，还有姨母对铃芽表达心声,10,Juniperlll,400207698,5.978224547714617
2599,6,这是一个回味悠长的电影，这是公路片不是爱情片，一开始冲着爱情片去的观感必然不好。看完时没什么感觉，但回头细想，再去看看解析就沉浸在回味之中了，开始为各种灾难而逝去的人民而感到难过，并且理解、心疼大臣。,10,琪妙物语,8396645,9.99981419685199
2600,6,洗不动了,6,我永远喜欢香奈乎,228435151,4.727225058920847
2601,6,很难评的一部，画面和音乐还是顶中顶，但剧情属于是向某些国产言情看齐了,6,橘子研究员,65606368,0.5148517964096555
2602,5,又重温一遍,10,春日匣,451020395,9.762253814141198
2603,5,心灵的治愈,10,ナベが可愛いです,499114769,9.721999585508437
2604,6,这剧情怎么跟东京迷城这么像啊，看一小半基本知道全部剧情了，日本所有的灾难题材都一个套路吗？但是最后一段劈山救母挺燃的。,4,DDDarjeeling,98597646,6.466098486632768
2605,5,铃芽真的是一个很独立坚强有主见的女孩。。,10,-冰岛热咖啡-,322283409,9.484027275755764
2606,6,真不好看,2,达斯牧羊犬,273186776,6.705821749761371
2607,5,两分给各位工作人员，你们都辛苦了。一分给画质。剧情两个字：史。我算懂了什么叫期望越大失望越大，这爱情线比不上天气之子半分太烂了，她说出没有草太先生不行的时候我说实话我都懵了？？？还有谜语猫给我滚出地球,6,神樂_kagura,475777102,7.690212699973387e-07
2608,5,感情戏确实牵强，但确实是一部不错的公里片，至少我看的很舒服。个人认为需要搭配解说食用，反正我看了之后体验要好很多。至于说女主颜控的，我只能说你没看懂，最后小女主明明看见了男主，所以相见梦中的人而已,10,污の门,475392565,2.3053039770791206
2609,6,草太草太草太草太,4,把绫波零还给我,13826644,1.0044723020152369
2610,5,第一次在电影院7刷一个电影，东京上空和大小铃芽相见真的是本片最震撼的部分,10,瑞德里亚,671007304,9.980924576087892
2611,6,最喜欢的一部，铃芽赛高,10,霖时语,406125032,8.631277428620962
2612,5,节奏偏快，但是音乐画面都是加分点。,8,蒙大力莎Mnkone,298242707,9.404575880679339
2613,5,史，感情线没必要，尤其是那句，没有草太的世界我很害怕，对一个陌生人比姨妈上心，只能说逆天,6,coffeeの猫,1720435633,8.979398226900349
2614,5,心灵的自我救赎,10,信与温柔皆失,553388265,9.824428532974045
2615,5,有许多小槽点但制作方面没得说，如果没记错本来宣传的没有说感情戏这事吧，我当时因为这个以为是纯公路片还不准备去看了，后面一看有感情线又去了，几个事件都挺雷同的,6,枫街逸巷,508383984,0.145433650476966
2616,6,新海诚是神,10,Oh_my_ma_ya,35774950,8.088130719078682
2617,5,嘟 嘟 嘟嘟嘟,10,叶落丶凡,289081836,8.651306184472126
2618,5,不错的一部电影,10,白黎沫泽,398708049,8.299173273737791
2619,5,画风很好，剧情叙事不流畅,6,咲幕流年,298244487,8.830119342453584
2620,5,相比前几部剧情确实弱了，不过还是很不错的,10,字符是什么鬼啊,159524635,7.355949566175556
2621,5,棒棒的，期待新作！！！！！！！！！,10,青山-呐,71647372,9.922650103571591
2622,5,三部曲一部都没让我失望过,10,没穿裤子的灰姑娘,681223494,4.305512054349078
2623,6,不要感情戏,8,枫落南门,435498349,6.9405079698144565
2624,6,完美满足了我一个大龄中二少年想莫名其妙的踏上一个莫名其妙旅途的愿望，前面节奏很好，后面男主被封印开始就乱掉了，两只猫的背景故事和心路历程完全没交代，像是工具人，男主和女主的爱情进展的太突然，但瑕不掩瑜,10,五颜六色的乌鸦,10481616,9.998838448536365
2625,5,我心目中的新海诚top1，我喜欢就够了,10,Twelve_Eight,678467227,9.92498794662598
2626,6,在电影院看的时候确实给我看哭了,10,天真晴,54767795,6.950790792559253
2627,4,除了天气之子就是他,10,吾王三玖,1856709899,9.117534943379717
2628,5,看,10,只会呵呵_,494247465,6.679394871483
2629,6,不错，但差点意思,8,年少欽狂,219898052,8.12877089274347
2630,6,感情线确实尴尬,4,天影云裂,33929269,3.0453042393201715
2631,6,相较于前两部，无疑是平庸的,6,linkum,90148493,6.253695095787835
2632,5,看完了 呜呜呜,10,啾啾啾啾鳩書,106796073,5.24846637034294
2633,5,三刷 好看爱看,10,Strawber梨-,396071429,9.739166050351528
2634,4,终于上映了,10,白米饭ww,1453754754,7.59167949104005
2635,6,太好看了吧，我难以表述，没人对错，只有对生活的继续和不舍，电影告诉的遗憾是不能什么都拥有，却也让你明白努力下去的意义。,10,望下公承,233236928,9.957107069709942
2636,5,开始播出的时候网上都说不好看，我看了之后才知道，这部作品讲述的是只有自己才能真正的开解自己。,10,老汤传奇,440673263,8.508633482513101
2637,6,emmmm…作画和音乐还是在线的。剧情一言难尽，建议不要太较真,6,明月携凉,38714420,0.1756831387760005
2638,5,诚，无需多言,10,无所事事的阿鼬,504417750,9.71122342879289
2639,6,小铃芽找到了自己的明天，那我们呢？,10,bili_286655408,286655408,8.944105744243636
2640,5,狠狠的爱了,10,本大侠乃逍遥哥哥呐,372190348,9.365941945282255
2641,6,那么多低星评分还能有9.8分，B站的控分可以的,6,我只是一个诗人,61865967,3.5634681429241377
2642,5,当时影院看的，只能说及格线，或许是期待太高了,6,Sayuhs,35658750,2.3352557943007
2643,5,大臣…,10,云晓曳,542458860,7.519565919683543
2644,6,瑕不掩瑜的佳作，本想给个四星，但是无脑给一星的有点多。带着偏见去看电影怕是折磨自己的啊，再加上我非常喜欢这部电影的男女主人设和几个小故事，以及堪称业界t0的美术和音乐，所以我决定给个五星。,10,零无澪-,179357317,9.99978896906269
2645,5,我就是觉得好看，觉得是史的就是史吧,10,Undyy,492213259,5.804459024222321
2646,6,三刷,10,吾爱诸如星川,39382916,9.417808219178081
2647,5,一如初见,10,一种清孤别样闲,393646193,7.482084928482156
2648,5,终于来了,10,珂朵莉-_-威廉,651418479,8.440797778338798
2649,5,五刷！,10,Hotear-,437478421,9.411764705882353
2650,5,好看，不愧是新海诚,10,爱喝芬达的喵,431994787,9.418651895405652
2651,5,就看画面，听歌，剧情表达的情感在我这占分很高，给不了，看每个人的体会吧，有点稀碎了。,6,方子雨天泽,509346936,2.4888118773103907
2652,5,太好看啦真的是巨作.！（虽然没有4k挺遗憾的）,10,哉の涑,513411998,9.539208271997445
2653,6,没什么说的 五星,10,山水煎茶z,28749877,7.189669419034703
2654,5,没那么好也没那么差 只是导演是新海诚让我有点遗憾罢了,8,lvsekb,407463167,2.060479917433508
2655,6,铃芽之旅的剧情不适合拍电影，而是一部番，剧情太赶了，每个地方笔墨太少，我认为爱情戏码删掉观感会更好,6,K-ser,179373661,0.7118016812734662
2656,6,新海诚这是得罪谁了？,8,茜罗揉出碎英繁,11659364,7.172606344983198
2657,5,放下昨天，拥抱明天,10,不爱吃萝莉的饼干,252979286,9.947596081176306
2658,5,分高了,4,寒韵竹凌,350840830,3.6363636363636287
2659,5,喜欢喜欢喜欢,10,鱼羽欲雨渔,471330827,9.78544074329401
2660,5,很棒了,10,十灭狱神,481042816,9.69709752763447
2661,6,一人看的时候挺好看的 虽说没有天气之子那样的震撼 但挺不错 希望下个三年 能更好,10,智乃酱世界最可爱,441718497,9.993337710081638
2662,5,去掉感情线变成之前的双女主会更好,6,kikyo桔梗神乐,299210301,7.869337711344099
2663,5,支持就对了,10,请嫑,701453848,8.333333333333327
2664,4,太美了，看完之后好喜欢这部电影,10,梦中拙作,630620886,8.572264936726729
2665,5,水平之上的作品，考虑到新海诚制作，就没那么高评价了…,8,Askaの上低音号,1319567202,2.558891218567505
2666,5,前来回顾,10,吾妻椎名真昼,525042764,8.600402494465719
2667,5,还会有下一个三年之约么,8,鑫尼鑫斯达,174535645,9.717832561735962
2668,5,还可以欸,10,柘彰,508719013,6.74486101875742
2669,5,今年个人最喜欢的电影,10,罚球才低头,91482809,9.236711115579737
2670,5,瑕勉强不掩瑜罢，诚哥还是继续加油,6,呜语Merele,491097034,9.790337088842882
2671,5,等了好久，终于上了,10,笨蛋舰长会梦到爱莉,519801151,8.939582367961382
2672,4,很震撼，但不止是画面,10,天罗方武,2049485211,9.862891097980523
2673,4,但是诚哥这次真的还需努力，但是不枉我想打五星,10,物化地的奴,1358996940,9.087682907355498
2674,4,我觉得非常好看。玲芽是三部曲中我最喜欢的一个女主，非常有个性，也非常负责任，她的那些冲动和不怕死，最重要的还是因为幼年失去了母亲，总结，画面，音乐，剧情都比较棒，当然你说不喜欢我也没办法,10,心累ya,1221592575,9.9153086385304
2675,6,你一定要一而再再而三的不由余地的去拯救自己,10,轻云墨雪,66409285,5.790517548975286
2676,5,故事观什么的挺好   就是这条我个人认为有些莫名其妙的感情线实在没有什么必要，我可以理解女主可能对男主一见钟情  但男主对女主……嗯……不知道它什么时候突然增长了爱意  哪怕是因为友情我都没这么不舒服,4,Ha奈奈奈奈酱,50654321,0.1263757557560785
2677,5,啊？,10,赤焰断念,517770925,7.484223051105047
2678,6,“没有草太先生的世界，我很害怕”,6,kmjwr,407540028,9.182100680298108
2679,5,画面感很好,10,泷辉梂涵,351889392,8.986337456346694
2680,6,电影院中有几段看得太震撼了,10,鹰原海己,37096438,9.215857264804146
2681,5,一流画面+一流音乐+稀碎的感情线，然后很不幸剧情因为感情线导致有些崩坏,6,山青行晚渡,180019984,7.370331484948876
2682,5,还得是诚哥,8,恋上纸片人,351666537,6.519070265814254
2683,5,如果再长一些，剧情线更详细清晰一些会更好,10,阿寧阿,362498426,9.66292531756348
2684,5,感情线刻画确实突兀但是也没必要打低分吧，就作画和配音来说完全能到五分，是值得看的。他不止是在讲爱情亲情，还有当时灾害下的拯救和新生,10,阿瑞没有斯,94375189,9.406856652006274
2685,4,不错哟~,10,明日香---Asuka,1941844634,8.401798224124736
2686,5,感动！,10,asukazeng,349430652,9.31733037324823
2687,4,电影院上线就去看了，还是只看画面和听听音乐罢,8,第19使徒-CCCP,1283960511,5.2678622702107525
2688,5,听到没有草太的世界我很害怕真的蚌埠住了,6,北岸キタ_Yets,693963867,9.638956240426563
2689,5,电影院已经看过了，看到上线来刷个五星,10,风带着我的告白,486920251,4.708658905203375
2690,6,真的很喜欢，电影院五刷，看一次泪目一次，很有深意，还去买了小说补完。,10,莱欧斯利Official,88517377,9.99714857391545
2691,5,电影院看过两遍了，很好看,10,小广君呀,456115653,8.585246402096633
2692,5,每个人都是自己的明天啊,10,翛蝶,1349079540,9.201576619771
2693,6,可能是起点太高，期望太大,4,吃烧白的阿鬼,13128522,6.845939046351144
2694,6,好，但节奏有点快,8,柒雪exe,253724307,5.86686812021978
2695,6,莫名让我想到了从前，我封闭的内心和深处的苦痛，我很喜欢,10,其实连我也不知道,74206255,9.993546704212395
2696,5,电影院看的，b站上了，说真的，如果没男主单纯的讲故事我觉得还行，你爱情又不爱情，灾难又不灾难，个人观点,4,爆报豹暴鲍了,392573906,0.27183381308683807
2697,4,好看…治愈，期待下一个三年之约,10,晴空风男,1203761495,9.908967772466045
2698,6,即使是在电影院看完的，极致的音画体验也很难弥补剧情上的缺漏,8,akrdr,11423516,7.393298535454705
2699,6,仍记得那天橙色暴雨…淋着回去的我,10,御坂妹妹10848,29941701,9.709592611794305
2700,5,剧情还行啊没有说得那么差，但男女主的感情发展好尬还不如那两只猫吸引我,6,青纹跳跳鱼,2043679598,0.02581315650920124
2701,5,感情线太奇怪了，全篇唯一还行的地方就是母子和解和最后的自我救赎了。三星给制作和配音人员。,6,艹草艹1,498402505,5.320411780682722
2702,4,满分，必须满分。,10,季姬击只因,3461572460546437,9.893481836067142
2703,6,就是画面不错，音乐也挺好听而已罢了,10,青叶摇杨,485327614,9.604753129922099
2704,6,影院看了两遍了，还是很感动的,10,星垂平野i,26639056,9.591990692814331
2705,6,所以大家都不想当石头是吗,6,冰色水果,2940837,5.5498131013114085
2706,5,男主跟女主的感情线我是一点没看懂，感觉好乱,4,fckjh,401033671,0.5087945273056416
2707,5,虽然对比前作一般，不过对比现在的工业糖精那就很不戳了,10,テイムフライヤー,471606723,9.169318054685602
2708,6,勺勺赛高！٩(ˊωˋ*)و,10,CyanoticFilm,29610644,2.4381928141050677
2709,6,咱就是说，男女主的感情戏能不能再模糊一点，能看剧情还挺不错，就是男女主的感情戏很离谱，很诡异,6,孤独的守城人,361871682,0.31137902555450014
2710,6,这是我第三次看新海诚的电影，当然前面两部全是国内上映过的。这次是公路片题材倒挺新鲜，整体还算中规中矩吧。,10,魔术小子,21581634,5.251403502864757
2711,4,扣一颗星吧,8,傻鸡炖大鹅,1039632952,4.29070609916092
2712,0,除了感情线剩下都可以,8,账号已注销,285946235,5.527849954157582
2713,5,画面可以，剧情不可以,4,雾切响子ccc,349491034,6.054160635961731
2714,5,建议配合小说食用,10,我老婆贞德贞美,327348011,6.58921685023105
2715,4,不用多说,10,心思念君,1597219939,6.305205655524774
2716,5,好看爱看，5刷了,10,阵羽蜜瓜,1793839339,8.367342786193442
2717,5,五星为了新海诚,10,御阪美琴,278924045,9.498900140338995
2718,5,除了画面其他并不出彩，家庭线，爱情线，个人成长线，都乱乱的。,4,黑色衣服卡其裤,81081449,8.26985522311713
2719,6,和室友在电影院看的，观感还是不错的，怎么这么多低分，奔着感情线来的？,10,十九是大可爱,221008281,3.847735232988916
2720,5,爱情线莫名其妙的，三颗星给小猫咪,6,37777c,1232537631,2.1861816915163965
2721,5,最有深意的一集,10,白菜工厂1145号员工,518098961,9.245776498103965
2722,6,帅气suzume,10,抱堇了天,285466,6.046993884772389
2723,5,特效不错 剧情还可以 切镜头很丝滑,10,落笔_画飘染,401901528,5.190333501360561
2724,6,不是为了感情线，谁看你新海诚！？画面已不再是优势，还放弃了特色的叙述方式。,4,云玄枫,325787973,8.835577919789126
2725,6,作为一个成年人，看完之后有点不舒服的感觉，具体来自于哪里我也不清楚。明明背景作画都很好看，音乐也还好听，就是觉得很难受，尤其猫咪又突然变成石头那块，挺不舒服的，那种厌恶感更强烈。感觉他好像还不如秒速了,8,雨非药物,11920410,7.704534972676492
2726,4,期待下一个三年之约ヾ(╹◡╹)ﾉﾞ~,10,春忆不解风情,1281243327,9.29123396327648
2727,4,好看，爱看，首映了就看了,10,小吉的饼干,1117269072,7.734239440165089
2728,5,结尾还是很不错的,8,陈皮虾本虾,327624418,9.025434260195913
2729,6,下次我再也不听别人的影评来决定去不去电影院了.jpg,10,31415926535x,9444976,1.9146517347804048
2730,4,终于可以看了！！！,10,Pixesの炎弾,1024497497,7.568052874973475
2731,6,没有爱情线就完美了，本来可以成为一部完美的灾难片，结果成了灾难爱情,6,StayLight戀光,321559451,8.17002956973491
2732,6,好康的,10,Cygnus鳯凰院,88051411,8.18181818181818
2733,6,看电影前读到过一条评论，不喜欢草太的人看这个有难了，觉得很精确，如果不能理解铃芽复杂又简单的心动，是很难理解这部电影的,10,鲑鱼不想旅行,9159160,9.89253715033395
2734,5,完美，吹爆音乐和剧情，意义也很深刻，第一次看哭了好几次,10,小澄a816,457219085,9.950174803253539
2735,6,灾难背后的是救赎世界，感情是随着旅行不断升温，东京之上那里的决定为了地上的千千万万的家，选择失去男主,10,Cc天火集团门口的猫,4727968,9.998566824155994
2736,5,/,10,太罗ww,228988756,7.484223051105047
2737,5,看哭了T﹏T，还去线下电影院看了一遍,10,哭闹的可可,394041078,7.689658753863155
2738,5,都挺好，就是剧情有点不尽人意,4,卐moon卐,1960056794,3.7757943035118724
2739,6,一般，爱情线太突兀了,6,肉包子Z,22013445,6.687770993515018
2740,5,之前在电影院二刷，等有机会重映的时候继续！,10,宫野阿千,9627736,7.98942353032809
2741,5,真的很震撼啊,10,ugoAge,527918072,9.612303844104709
2742,5,等下次出新品吧,6,游生谱梦,413100263,7.6541773060261065
2743,4,行ってきます!向着未来,10,happyの夜羽叶一,1308072848,6.344033454895108
2744,6,优美的作品，但意犹未尽。为什么呢，仔细想想，是因为这段旅程给了我像是短暂的抽离了现实的感觉。现实虽并非如次，不过嘛，再想想人人都会拥有不同的旅程，只愿，都会获得独属自己的最珍贵最美丽动人的记忆吧。,10,苍见,14877259,9.99999999984301
2745,5,真的有笑点也有泪点虽然有些地方感情线有一点点突然但还是很喜欢啊,10,卷心菜上将,474866314,9.874732009615526
2746,4,画面精美，我不管，就要给满分,10,秋林你不是人,3461564527020523,9.763832807124086
2747,6,画面不错，剧情呃呃,8,Lived丶Devil,109667731,8.361067918676728
2748,5,虽然我很喜欢这部电影，买周边、看电影、一上线就回看，但感觉在一些方面上还是有欠缺的,8,之子夭灼,402698758,8.08583782449714
2749,4,说实话，这个剧情适合做成番看，电影时间有限，感情线太少太快了，如果是番剧就有足够的时间,10,暮风_MFeng,512583867,0.20510863038120553
2750,4,感谢新海诚，在初三的低谷治愈我,10,望舒小保安,1738111043,9.930390733063248
2751,5,当时去电影院看了两遍，可能铃芽与草太的感情确实在电影中描绘的不够多，但是不能因此就否认它是一部好的作品。铃芽是一个坚强的女孩，她展现出的勇气和冷静是我认为这个角色最大的魅力。,10,Mikoto-Kuroko,1974489588,9.998787872334825
2752,4,好行,10,Yoshitsugu桑,350227240,8.461538461538456
2753,6,男主又帅又可爱，玲芽棒棒哒，但我最喜欢小姨妈,10,亲亲君河0622,23594155,9.775828004669165
2754,5,在电影院看的 配乐不错,8,观音之鱿,515914614,6.796186592381542
2755,5,好看的啊啊啊啊！,10,oncyanly,525902262,8.77658048888302
2756,6,动漫电影巅峰之作,10,black-迷茫,30989195,8.120289631998968
