,ulevel,comment,score,uname,uid,score_predict
1329,6,5555555,10,Nomi子衿悠心,431164518,8.333333333333329
1330,5,比天气之子好看一点,6,Ang归途,299505665,8.723800477574223
1331,6,henxih,8,傲娇的惣流,156950384,5.0
1332,5,画面六分 剧情一分,6,Y__OD,457853756,2.953413646156636
1333,6,虽然有些地方有点尬，不过还是蛮打动我的，结尾拍的太好了，去影院看了两遍，每遍都很感动，曾有痛苦到以为熬不过去的时刻，看到这段得到了宽慰,10,男神美颜盖世,15452358,9.990642051262324
1334,6,给个5星吧，因为最高只能给5星,10,御坂10659号,27789461,2.903706571238284
1335,4,就满分 ，第一次电影院看的时候很多都没看懂，，还和别人吐槽了一些，于是看了看观众评论说的细节，然后就去电影院看了第二次，对不起！这次给我震惊的头皮发麻。,10,True肥来啦,243167928,0.38525012110422807
1336,4,新海诚太牛啦！！！,10,-Vivi程-,492014096,8.360048510438657
1337,5,这几年来最喜欢的电影,10,frappadingue,414267865,9.435138202619786
1338,6,影院的观感真的很棒，音乐画面的搭配还是那么的精美，让人不由得起了鸡皮疙瘩,10,拜拜阿比君,17644949,9.721824246318233
1339,5,满分满分捏,10,皓月翱翔lhx,379326253,9.926830336206468
1340,6,我c了 太喜欢了 刷了好几遍了我受不了了,10,Siesta-暖,17389327,6.715713626732127
1341,6,⑥,4,何似在ren间,350904959,8.333333333333329
1342,6,真的很爱这部。,10,猫咪卷羊,32668455,9.311778582397173
1343,5,特别喜欢铃芽和十二年的自己和解这一片段，铃芽也是我在灾难三部曲里最喜欢的女主角,10,枷木kk,53728601,9.81464827500363
1344,6,节奏和剧本还是有进步空间，但比之前新海诚偏奇幻类的作品已经有明显进步。不过个人还是更喜欢他的现实都市爱情故事。,10,两仪龙,80808,9.128984261515109
1345,5,剧场还是老一套,4,可爱诺言,279368571,7.014236834421257
1346,5,现在这评分逆天，上9都难,6,原神星穹铁道代肝沙砾,1991414179,7.815428926108822
1347,6,满分是看颜值和动画组的辛苦打的吗,4,世界总是围着猫猫打转,89572495,6.307478022819284
1348,5,这部剧情着实有点拉，希望新海诚下次再给点力吧(눈_눈),4,圆的吼姆拉-,499106573,3.4103361283912825
1349,6,除了画面依旧精致外，9.8是不是太高了，剧情究竟讲的啥，一见钟情？莫名其妙的旅程，莫名其妙的灾难，莫名其妙的解决，结果是只有工具人猫咪受伤的世界达成了。。。,6,叶鹤华之章,43170986,0.04804224639809562
1350,6,剧情一般，但作画与音乐在线。,6,老大峡,18725686,7.709380273296411
1351,6,这剧情能9.8吗,4,蓝了天_白赴美,313072420,6.878370516958005
1352,5,不及格还是及格，这是一个问题。原以为那是一个起点，没想到是一个巅峰,6,不拍吻戏的樱岛麻衣,360401497,1.5245754274143541
1353,6,歌好听，画面好看，没了,4,心叶叶叶叶叶叶叶,22720969,8.80900489471059
1354,6,画面和音乐不错,4,真是可爱呢233,242450480,9.330546860715744
1355,6,1:31:40，替自己姐姐养育十几年的孩子，到头来跟一个没任何关系的男的跑了，真心替姨妈难过，为了孩子到了40岁也没有谈恋爱结婚，心里只有铃芽这一个孩子难道还不够吗，快把姨妈的青春还给她！,4,绘云中月,354904227,0.5947577250051661
1356,5,画面音乐真的顶，但是感情线真是一言难尽,6,帕朵--菲利斯,512979866,6.994902959918758
1357,5,没有草太先生的世界，我好害怕( ᵒ̴̶̷̤໐ᵒ̴̶̷̤ ),6,电次之痛,483174755,7.313294904152673
1358,4,评分是给作画和配乐的,4,----kokomi----,1107236214,8.630519042013558
1359,5,除了感情线都挺好的,6,饕餮猹,505121803,8.05800760544209
1360,4,提前评论吧，已经看过了，个人认为是新海诚最爱的一部作品了,10,二次元生活を考える,539658857,9.104340402510497
1361,5,音乐不错,4,热猫店员,161861906,9.15444202488971
1362,5,画面完美，BGM契合，故事跌宕起伏，非常棒。,10,闹小闹小将军,490616099,9.996847816521502
1363,6,不论是画面还是故事，都足够打动人心，美好又柔软的旅程。,10,晚起看月出,15666521,9.99839158107149
1364,6,分给新海诚，我喜欢他,10,小埋的冰阔乐,290414627,8.758422621147323
1365,5,咩咩咩,6,双丸子头才最可爱,35595335,3.6830880321097617
1366,5,二刷感觉越来越好看了，音乐是针不戳，现在看剧情其实并不会很差可以的,10,綾地宁宁の启爆器,442954907,8.130722552092426
1367,4,贡献三张电影票力，以后每个月刷一遍！,10,三月七的月,521622961,6.176630497429753
1368,5,感觉还可以,10,fuesohjhojfa,255032571,6.643429129648732
1369,6,音乐无敌，配音无敌，画面无敌，女主可爱，剧情只能说中规中矩，男女主感情太快了...(ᇂ_ᇂ|||),10,滝川みうMiu,36710514,2.261495144810458
1370,6,以个人的感情反映灾难中所有人的感情。铃芽就像是灾难中幸存的人，很痛苦地逃避，草太带给女主的感觉偏向于引领着她见证灾难，面对灾难，走过灾难，最后在草太遇到危险的时候，终于，铃芽可以独自战胜这场灾难了。,10,请以吻烫伤我,259935881,9.99160807251864
1371,4,我看完了，前面还行，后面就不明白了，我咖奶，我多打了一颗星都算好的了,6,老黄绎,442792252,0.10226599524989721
1372,5,假如能超脱爱情，便是好的，遗憾,6,断剑灵猫,109614998,9.929222878282983
1373,5,音乐加分太多,10,Phonier,293346410,7.355721459379697
1374,5,这下很难选啊  铃芽和阳菜,10,精灵爱好者,7255134,6.557030945603186
1375,6,感人。,10,NXN333,355152111,9.207453709163813
1376,6,完结撒花,10,雾中窥欢喜,173019386,9.098030232713851
1377,5,‘新海诚’式浪漫,10,再见_华灯初上,18374283,9.765191291000614
1378,6,谢了，已哭瞎,10,ユウミ,12216671,5.615171797859196
1379,5,新海诚yyds,10,怪人王123,288488815,6.232054202849596
1380,5,一颗星给音乐，一颗星给作画。,4,fan方向旳钟,442050964,3.1948951980191485
1381,6,鉴于阿b这个评分机制，如果和新海诚往期的作品比，那只能拿四分，如果纯粹从叙事剧情呢，那恐怕只能拿两分了，但综合画面制作水准以及配乐和插曲，还是勉强给个及格吧。这个故事线实在是太弱，冲突什么的也很勉强,6,大幸高比例,4155931,0.008813599236534575
1382,5,刷了三遍了,10,fuzhika,172419366,9.441709183726491
1383,5,LL,10,哈哈皮二奇,1508251762,6.451612903225796
1384,5,！！！！！！,10,哈多给11,308112517,7.159940209267557
1385,5,看完都不知道这动画有多长，一直就看完，没看时间，强,10,真的月饼,161793620,0.3570964286458844
1386,6,二刷，结合弹幕看懂了很多地方，还是非常感动,10,为了嘲讽,25972424,9.925262312995049
1387,6,下次别引进了。画了钱，诚导这电影不大行。,6,di0甜甜圈,7426900,0.5023416663476321
1388,4,剧情受不了，但影院的视听体验确实是一个新高度,8,noark_,517504287,7.611511972604199
1389,5,全剧最大败笔，那只猫。,8,元小兔yxt,316315709,5.2584555331067175
1390,6,新海诚电影的歌曲很神奇，没看剧之前感觉很一般，看完之后就被深深带入，好好听,10,偶有块腹肌,281196668,9.829557025803773
1391,6,反正我觉得是一部很好的作品,10,阿星的窝点,262949683,8.142873215362993
1392,6,祝我也能找到属于自己喜欢的人,10,白井黑岩,11650480,9.652440677168808
1393,6,二刷达成，很喜欢这一作，感觉也能看出新海诚对于灾难下的人生思考的过程，这部也是公路片自我救赎的路线，和痛苦的回忆和解，重拾勇气走向未来(*˘︶˘*).｡.:决定哪天去把小说给看了,10,堆烟烟,11546291,9.999995070794476
1394,6,好 很好,10,暗影杀手五号,276008144,8.823896051089147
1395,6,太爱这个画风了TvT 剧情略微生草,8,忽狗,312275791,9.69726884444628
1396,4,难受，男主的戏分都有点少，实感情线很突兀,6,Light_YH,475600166,7.373281766635328
1397,6,二刷走起,10,喵刀姬,40320009,9.644662329455384
1398,6,与我生日就差一天的铃芽带给我一往无前的勇气,10,萱苏230461,67226972,7.799178935837902
1399,5,立意很不错，可惜两个小时不能装下诚哥的所有想法。,8,撒库啦酱の,400742998,0.6458621847209189
1400,6,一星给画面、一星给音乐、一星给小说，此外电影真的是想说的什么都没说明白，根本看不出来有什么内核，也是辛苦那些up主和粉丝们了，解析了那么多，这电影就应该先等up主和粉丝们解析完要讲嘛再上映给大伙看。,6,是憨小赵呀,346111316,0.003204747085895354
1401,6,两分给画面和片尾曲。莫名其妙的爱情，突然就那么深情，莫名其妙的对话，喊了多少句名字和等一下然后无疾而终，公路片也不是很温馨，和路人的互动也很莫名其妙，强行温暖,4,萧瑾邪,131418928,6.266777633062167
1402,5,小说也看了！！真的很喜欢,10,本初無,1703139058,9.046487174476557
1403,6,故事讲的不如前两部好，其他部分（如画面等）还是不错的,8,唐可可我最闪耀_,37607037,6.6919934682447035
1404,5,真的很爱bgm 满分,10,维修小太阳,11212106,9.866970649603939
1405,5,及格的公路片,6,乔上的kano,381745890,3.1215489782680605
1406,5,感覺誠哥的作品打動不了我了。,8,连名儿也没有,259113353,6.636023497951209
1407,6,在四周都是火焰的地方，草太却被冰封在小山堆里成为封印的要石，很喜欢这种设计。铃芽穿过废墟和火焰来到草太身边也很感动，但最喜欢的还是大臣在听到铃芽的“谢谢”突然眼睛亮起来的那一幕！大臣也许只是太寂寞了吧,10,冫令水幽靈,121884850,9.999986187906767
1408,5,不得不说还是那么感动，三年后见！,10,-洛水华风-,383617713,9.360896432172613
1409,4,非常好捏,10,茶颜雪色,1119670464,8.413849947179772
1410,4,刷了五次，只评价一个字:好!,10,成分复杂の音游人,1479981511,4.880906328901058
1411,6,中规中吧、但在日本背景讲灾难共情日本人，我真共情不起来我有些反感……但凡故事换个国家背景我都会特别喜欢,6,森一LY,266138516,8.054803788370416
1412,5,喜欢爱看,10,红尘愿随,497924265,9.312611782544026
1413,6,看就完事。,10,我邱清泉要敲他的砂罐,19189463,5.090262308783883
1414,5,好的电影是会让人向前走的！,10,昧玉,522223320,9.783595768374854
1415,5,电影院看的，剧情挺拉的，只不过画面很好，给个三星,6,高性能蘿卜子,453431900,3.9931059190402065
1416,5,很好的一部神作,10,二刺猿の変態,335084588,8.21412868115522
1417,6,制作好，剧情乱，爱情线莫名其妙，不如删了爱情线多给些亲情描写，比如姨妈和女主的感情，多给些儿时女主成长的剧情就更好。内核还行吧,6,notxing,16953525,2.260796300705956
1418,5,虽然有些细节并不完美但毫无疑问是一部优秀甚至说顶尖的动漫电影。,10,一只小鸡丸丶,280471005,9.865349224036231
1419,6,如果把铃芽之旅看作一个童话故事是很优秀的。,6,是神志,162493080,9.780853420553717
1420,6,非常好铃芽之旅，使我非常治愈,10,偷偷亲巴基一口,38037780,9.505745160288434
1421,6,嗯及格,6,cssci,102773361,3.245979749851097
1422,5,泪目 铃芽再次见到小时候的自己 灾难让唯一的亲人失去的痛苦和泪水才是一股很强的力量 配音一如既往的出色,10,Noli拯救世界,179785200,9.99986882087371
1423,5,好看啊，后悔没去影院看,10,网购记得录开箱,480055364,2.966989944530345
1424,5,泪水与释怀，亦是心灵之旅,10,鸢锦是个女的,439860783,9.990225929697171
1425,5,就这么多。,6,豆豆痒,20886141,7.484223051105047
1426,6,有点遗憾，感觉主题一宏大，人物剧情节奏整体协调就有问题，视听还是新海诚的味道,6,两手空空待我归来,11317925,9.637645151186897
1427,6,仿佛永远分离，却又始终相依,10,唐-小花花,243838862,9.990399753057158
1428,4,三月份月考完在电影院和几个好哥们看的，三部曲最后一部了，还是那句话，新海诚牛逼！！！,10,Yer丶特,694245460,6.850546161713571
1429,5,跟朋友么班去电影院看的我当场汗流浃背，从头笑到尾，你猜我在笑什么，看在诚哥的面给个3⭐,6,菜就关起来啦,436841980,8.56594238752313
1430,6,看到9.8以为普遍五星，然而一看并不是，看来还有下降空间,8,我永远喜欢及川彻_,49786231,8.270284718603891
1431,6,咋说呢，音乐画面各个方面都超棒的，但我还是理解不来感情线的突兀，就挺莫名的，有种女主被拍花子了的既视感，然后甭管因为啥原因，因为刚认识的人和把自己养大的人说那么重的话属实挺离谱的。,6,夜安翎,2240579,3.5279981087374868
1432,6,凳子是地震断了一条腿的，帮我顶上去，让大家都知道,10,Godde5s,223640779,5.903191565909843
1433,5,无论如何都有人会挑刺，但是我认为这部作品是好的，至少当时在影院观看很欢乐，我依旧喜欢老师的作品！,10,Xuelianer_,385153126,9.98232366745042
1434,6,让我想起了我的童年和青春期的碰撞时期 曾经的感觉回来了,10,KRO-1,104383607,9.974144671152542
1435,6,画面不错，剧情一般，有些地方过于低智，新海诚终究还是无法超越自己,6,斋斐肆,39092513,8.686307875465692
1436,6,挺不错,10,猫龙茶,15397328,8.674403166093358
1437,6,很空洞生硬。,6,空素天明,293568644,1.7421229966225005
1438,5,爱与亲，生与死,10,这名不好娶,621146075,8.894453172521953
1439,5,这剧情是否有点,4,呆头鹅皮皮马,379419503,4.526155257445954
1440,5,好看，但是女主跑这么快是认真的吗？？？,10,李狗嗨2011,385611930,0.647372071704666
1441,4,哭死了呜呜呜 大臣,10,小天使,1374613,9.291927938717286
1442,6,感觉剧情推进地有点突兀,4,贪玩小米莎,226204643,4.2344940580865025
1443,6,再...相信一次爱情？,10,JimLucas,82452415,7.8347322701553646
1444,5,Thx.,8,sxjeru,347693694,5.0
1445,5,后劲真大,10,芥末味的咖喱,241661633,9.12465106504809
1446,6,小猫咪好可怜,8,前往大风车,32984582,9.220588124108842
1447,4,二刷打卡，在内陆上线的第二天就去看了，在电影院真的被震撼到了！新海诚，期待下次再见！,10,蓝草莓爱德云,520370290,9.66098984628754
1448,5,前半段剧情上虽然有些小bug，但是整体节奏还是不错的。后半段故事节奏开始一泻千里。画面和音效我愿意给10分，电影的故事情节可能不到5分。有点可惜如此豪华的配置。,6,白鹅鱼翅,476227637,0.07673359511417788
1449,6,诚哥下次真的别走商业化路线了……“没有草太先生的世界”这句话不像你能写出来的……明明是这么完美的剧本，要是写成师徒我都能理解这句话……为什么是恋爱……,8,我の神啊,4865121,3.383738038908999
1450,5,在b站看是第一次看，感觉人物情感刻画有些地方不充分，剧情有点云里雾里。最生草的就是那句“没有草太的世界”，在看之前就略有耳闻，看到那一段时虎躯一震一种既视感，感叹果如所传，有点突然。3星给画面和特效吧,6,成为六级号然后白嫖,411349965,7.151229387659371
1451,6,电影主线是跟随大臣的指引，找蚓厄的所在地并镇压，那么请问电影没一点时间插叙大臣的故事吗，天气之子尚且介绍清楚了女主的背景，我们中国人对日本人的传统文化又不了解，看得一脸蒙圈。,6,予昱羽,291167903,0.13489468039298624
1452,4,超级棒,10,ovo暖光,477250931,9.781512605042016
1453,5,泰裤辣~电影院看过一次，现在再看一次,10,安哚咪丶,25202003,0.7419631800030135
1454,6,再看一遍，依旧喜欢,10,云海中的星星,92707661,9.610813605035295
1455,5,思来想去还是3星吧，不值得去电影院看233,6,Noel・,345462253,3.066528850738525
1456,5,女主有点抽像，剧情一般般吧，有一说一画的确实好看，音乐也挺好，忽略女主的抽像想法还是值得一看到,8,来自未来的音符,479850030,6.945612984994033
1457,5,故事不够深，至于为了爱放弃世界，我们现在看的仙侠剧都这样，所以无所谓！,8,蚂蚁办公室,391786182,8.23928806331772
1458,5,我觉得这部真的太好了，剧情把控的太到位了。泪目了、、、,10,ZGeeeee,475095567,9.624976023820462
1459,6,二刷 看到最后小铃芽找妈妈的那段还是忍不住哭了,8,阿秋阿秋一颗葡萄树呀,12132340,9.85245457452041
1460,4,四刷不厌,10,小乔的粉笔,418021618,9.32352984168951
1461,5,我怀疑我是个木头，大家都说铃芽恋爱脑，但除了医院那句话我怎么没感觉出来,10,半青颜,480187848,0.2113568912808872
1462,5,不管你现在有多么悲伤，铃芽以后都会好好长大成人，未来并不可怕，虽然现在你觉得世界一片黑暗，但是黎明终会到来,10,子非雾也焉知雾痛,23765481,9.989841255641998
1463,6,好好好好好特效好,10,Tsviolet,288123583,2.81955954527504
1464,5,期待下次三年之约QAQ,10,丶断桥の烟雨,444232605,9.888501833833223
1465,6,三分是给他的画质质感的，但显示两分是因为我看不明白这个剧情,4,PomeloIce,149896907,0.08318650806693695
1466,6,呜呜呜猫好,10,Yuuu语,6441610,5.496988959997655
1467,6,优点很多，缺点也有一些，值得4星,8,TES狱文波,26470183,8.451351936184743
1468,5,剧情有点稀碎，但是音乐神中神，剧情再好一点我直接吹爆,10,封墨无痕,38378596,0.40380921865133645
1469,5,青春落幕,10,二次元你我他,431263897,9.59708107202941
1470,5,新海诚 你能不能写点好的,4,骤然狂怒之欲,4121055,6.794523734877778
1471,5,画面很美，然后呢 额 画面很美 额总之是画面很美,4,子龙吃烤肉饭,10102673,9.284445395056457
1472,5,期待下一个三年之约！！！,10,cq_tanyu,514403931,9.70721692636504
1473,6,整体画面水平在线,10,芳文大好,13889937,5.305657077668057
1474,6,五分给猫猫和东京上空捏,10,奥世,433171940,8.840423274680004
1475,6,可能电影院的效果更好。曲子不错，男主很帅，虽然看了两小时凳子，感情线有点突兀，但我喜欢铃芽救赎她自己，感同身受一时半会睡不着。,8,面灵气ちゃん,341900184,9.045223624679002
1476,6,mxx,10,约粉吗主播,89511045,5.0
1477,5,作画分镜还是没话说的细节狂魔新海诚，但感情线方面个人认为有些突兀,8,莉絲佳,50974546,8.899247686179892
1478,6,几周前刚看的 观影体验真的很痛苦,6,Nattravnen,10865188,9.24768479244941
1479,5,你会在阳光下长大成人，因为那都是注定好的事情,10,_夏拾叁,527635538,9.964512693317689
1480,5,只能算9分左右吧,6,星刘刘,498750057,4.486763909453202
1481,6,男女主情感线太突兀了,6,我真是氟气,227825891,5.939731991917259
1482,6,玲芽真的是高中女超人，这体力无敌了。爱情戏能多点笔墨就好了，现在这个有带点突兀,10,暴脾气的老板,10546565,4.91150342109732
1483,6,你说得对，但是你不给铃雅之旅好评你就是现充,4,牙阝八乂,388334369,6.934628209339575
1484,6,感动呜呜呜,10,破风挽云,43977693,7.60447455267637
1485,5,yyds,10,-----影_,94378672,5.0
1486,5,感情线有点突然了，然后剧情也没有特别出彩的点,6,壹壹㐅,347459996,6.709254153615367
1487,5,对我来说是电影院五刷过的治愈神作,10,全鱼灸,291861,9.768555783054826
1488,5,看了三遍了,10,平生夜雨不微,389381670,9.280656204767164
1489,6,对于灾难受害者的描写是很到位的,10,泠丶云,8387691,9.413423984870501
1490,4,好看多看,10,情川丶,505958393,7.169310334801469
1491,5,只能说一般，感情线发展不合逻辑，剧情也有太多没说清楚。如果做成长的番剧会比电影好很多,6,角度HJ,366438263,1.1476051362719708
1492,5,还不错吧,10,士剑一生爱,442727605,7.896664887134952
1493,6,两星最多了，虽然苛刻了点，但当你抱着期待在电影院看的时候观感确实如此，说不出来优点，作画稳定发挥，缺点就不用说了。,4,大和又蓝,225329700,0.3039320860391648
1494,5,支持( ﹡ˆoˆ﹡ ),10,一宵冷雨-,523116945,8.705146390161698
1495,5,1.椅子的细节讲得不清不楚的 2.白猫让男主承担自己的责任，内涵感觉很怪 3.黑猫像是为了推动剧情而强行出现的 4.感情线太突兀太奇怪，亲情线也很短     暂时想到这些，字数也有限制，我看完感觉一般,4,-等待着花开-,453537633,0.4082508343830804
1496,5,影院三刷，现在转战哔站！好好好好好！新海诚and Radwimps yyds,10,1198公里,456201348,7.148828564727387
1497,5,哪有感情线，感情线都这么淡化了，《铃芽之旅》明明就是铃芽自己的旅程，见证的事铃芽的成长,10,Living_God,360445455,9.434345452069735
1498,5,剧情水平下降,6,霂hhh,323811715,1.1139190480686079
1499,5,歌好听，猫可爱，但是剧情很一般，故事讲太急了,6,林韩酱,455721088,8.411027728664966
1500,5,七个月没看了，还是很好看,10,よう阳,620496145,6.6909768542358625
1501,5,无论故事如何 我们终将继续向前,8,LRay37,1762084652,9.835382542338793
1502,5,一个字“蠢”，美术制作给两分,4,飞机匪气,277804120,1.3118469238174224
1503,5,剧情不足以支撑画面的精美，说补小说才能看懂的话，本身电影剧情就是有瑕疵的,6,嘎嘣巴扎脆,475144362,5.722365748870242
1504,5,新海诚的电影，一如既往的让人很感动，最后大臣变回去的时候真的忍不住了，太喜欢大臣叫玲芽名字的时候了。,10,我不够狠,51617845,9.918160807844256
1505,5,4月份的时候就在电影院看过了，现在有机会能够温习，我仍然很喜欢《东京上空》的部分，人们平常的生活即将被他们看不见的灾难打破，而他们却看不见，再加上bgm的烘托，让我喘不过气，让我浑身充斥着无力感,8,bili_488104801,488104801,9.995775335531786
1506,6,三部曲yyds,10,战地记者张大夫,15895987,7.457370510684701
1507,6,两分给画面和音乐，其他给不了一点,4,渚薰_ZX,14634187,5.833230507558451
1508,6,这短评大战太恐怖了。。有很明显缺点是真的，不过也用不着全都打一星或者五星,8,等到黑夜翻面之后的你,183245633,0.9729808063405909
1509,5,看不懂的能不能似啊，还抓着爱情线不放呢，草太作为男主的确塑造不够，但是铃芽小时候确实在常世里见过他怎么就不能去找了,10,Prominences_,496451109,4.991155044436817
1510,5,凳子的腿飞我手上了,10,あほう君,477739667,8.90960534431154
1511,5,好喜欢这部，狠狠爱住,10,肆十一月_辞,177809712,9.837093041328993
1512,4,我个人来说还是很喜欢铃芽之旅，^_^，期待新海诚的下一个作品,10,Ddehzhbsv,1644619923,9.717122129733012
1513,6,锁分是吧，本来在我眼里值四分，但现在我只想打两分，但为了拉下评分，我只能打三分,6,永远爱乐正绫,95138314,4.851885192182285
1514,6,叔叔卡分了，但是看完该表态还是得说，剧情可以说逻辑似完了，人物之间的羁绊也突出一个莫名其妙，新海诚走不出舒适区就别勉强自己，爱情亲情两手抓你还没这么大本事，写个完整的条理清晰的故事比硬要深度更重要,4,国家一级挖矿工,26639558,0.023513202297806846
1515,5,真的差点意思,4,星雨-坠,351771103,6.873419377287156
1516,5,极度若智的感情线和亲情线，两分给画面和音乐,4,Getty的阴谋,441656130,5.141429260015319
1517,6,不解释，新海诚nb,10,消嘤器锤嘤嘤怪,325703420,7.707618495445346
1518,6,值回票价！说是神作吹的有点过，多少有些瑕疵，但的确是优秀的作品，给5星,10,asdfnice,14827018,8.983136219626665
1519,5,傾心,10,虞戲時,99990081,8.333333333333329
1520,6,整体看来依旧还是重小节而无大义，虚假的美好之下掩藏精致利己主义，这种意识产物还能被推崇，只能说对面文化输出做的确实好。,4,颠不乱,11297020,9.998463568752618
1521,6,好好看，当初没有去影院看一直等……真的好好看好感动,10,曼曼家的猫,17464183,6.626068814597609
1522,5,"依旧是最美的风景,最美的人",10,玉笙し,276299494,9.89274707041234
1523,5,不能理解男女主感情发展之迅速，女主用自己换男主更是离谱，明明啥救援方案都没有就一股脑的去了，要是再打磨一下会更好,8,沐浪的人,478075875,0.4426104813717846
1524,5,评分两极分化，但是我电影院三刷看下来是挺喜欢的，只能说各有各的喜好吧,10,白砂糖拌巧克力,491203149,9.748302817239795
1525,6,遗憾之作,6,考高分滴人,210134967,8.75794665512337
1526,6,我觉得可以哈,10,耶darling,36426696,7.484223051105047
1527,4,说实话观感还行,6,makozjj,1886330727,4.098935579623168
1528,6,新海诚的电影总能治愈我，使我浮躁的心平静下来。,10,最上川_,109460314,9.995530791843102
1529,6,大臣好惨，就不能想想办法换换班吗？让大臣能时不时出来透透气,8,御景柚姬,2540899,7.009763744632048
1530,5,新海诚这次果然也没有让人失望呢！期待下一个三年了。,10,向阳的鲸鱼,482165897,8.399282343950889
1531,4,看到最后蚌埠住了太感动了,10,某科学的超自然,511196259,7.793404529468361
1532,5,很喜欢！,10,林克百合子,501288100,9.259649464392876
1533,6,最后一段做得太好了,10,此名用只于展示,33388839,8.121953748368933
1534,5,新海诚巅峰之作！！！,10,Phantomさん,342025588,8.952535968174367
1535,6,顶了天4分,8,寒炎五月_Official,49875661,5.685218741404628
