,ulevel,comment,score,uname,uid,score_predict
3695,6,继承了新海诚电影一贯的特点，画风优良，场景真实细腻，人物性格情感塑造饱满。抢了首映在影院观感不错，声画配合得很好。但受电影篇幅限制，在剧情走向和剧情连接之中有所不足。整体上瑕不掩瑜，是一部很好的电影。,8,星零天,52836794,9.999999975975092
3696,5,近些年最触动我的电影，剧情环环相扣，画面每一帧都是壁纸，最后铃芽的自白，很契合我的现状，泪奔唉意难平呀。,10,逢四叠阳关,335018825,9.998939740393757
3697,5,画面非常震撼，特效非常棒，是新海诚的风格，就是剧情差了点,8,iPad114514,650722316,8.323236032113073
3698,5,全片很好,10,一只曦月鸭,648469539,7.726070643769724
3699,5,太戳我了！,10,死契SAMA,476889304,9.62406015037594
3700,5,好看，题材风格设定画面都戳中喜好,10,一方通行大人,521409785,9.627999682281818
3701,6,在画面和音乐上的表现依然相当优秀，是能够带给观众顶级视听体验的，可惜的是在剧情的推动发展上稍显突兀，人物描写塑造上缺少笔墨，想表达的内容太多又都没描写到位，说白了就是没把整个故事讲好，依然期待下部作品,8,天晴晴丶,24089108,9.914413395087625
3702,5,画面依旧震撼 喜欢。但是感情线也太突兀了也没看到小彩蛋 挺遗憾的,8,一条杠An-,1811835182,9.941137837453413
3703,5,大场面很足，感情线仓促,10,DNFGE_,340932767,9.33881983770893
3704,4,给画面两分，给人物一分，还有一分是感觉剧情还行，没有别人说的那么差劲，可能就是因为大家对新海诚的电影期望过高了吧（个人观点）,8,无所谓我只是条咸鱼,487185827,0.16106186348577856
3705,6,感情线有点刻意和突兀我觉得，最后一幕不是和男主见面说你回来了，换成小姨更好。主题是自我救赎和亲情.男主感情线其实有点牵强。不同你名 天气是互相救赎。铃芽主题是自我救赎和亲情，解开心结。不必刻意追求爱情,8,恋丶不忘,37675286,9.997128587525221
3706,6,作画细节，剧情细节都太妙了！,10,点击自爆,329855450,9.88409102822777
3707,4,三年磨一剑，但是我觉得还不是很好，如果说是爱情片的话，爱情描写不足，说亲情的话太过于刻意，感觉可能不如之前，但是已经很好，剧情上的话，上面有点小问题，是不影响观感满分十分我能打9.5分,10,ミン・ユアン,1342650289,9.670419076937979
3708,4,音乐和特效很不错。,8,爱喝巴菲的巴菲特,1541663384,8.250978431553559
3709,4,如果没有感情线这将是一部好片，没时间敲磨感情线也不用拼的这么不伦不类吧……,4,秋日落棠ovo,1966583119,0.009576797259778225
3710,4,好看没话说,10,荞落落ovo,364756295,8.018023863581856
3711,5,作为一个每天忙碌的高二学生，在清明节抽空去看了这部电影，感触真的很深。我喜欢这个故事，电影的音乐和画面都很优秀，本来对高中生活产生了些厌恶，但看完之后似乎对未来又有了一些希望，感觉又有动力学下去了。,10,原原原原原子,507564049,9.999696248888526
3712,6,画面不错，有些地方可以处理的更好 音效很值得夸 主线感觉不明显 支线有点杂 男女主感情线也有点莫名其妙 总体还行 看的很开心 不知道为什么在电影院一直笑跟看喜剧一样,8,活不了了死也是可以的,282446924,0.7803394494199822
3713,5,可以，没有很差，看完之后可以看一下B站的分析,10,星辰-Snow,522981952,2.235515734273833
3714,6,女主刚开始脑回路反应有点慢，后面慢慢跟上了男主的节奏之后，开始喜欢上了这个真诚勇敢善良的女孩子，剧情衔接的细节点很多，环环相扣，最后又回归原点，早在最初的相遇之前就已经开始了这场旅途，值得反复观看,10,奈奈夏目,50663400,9.999999251593568
3715,6,佳作，音乐剧情整体来说没有问题，设定没补全，人物不够饱满，最开始到男主变成椅子那部分看的很难受，之后好很多，中后期很不错，但太多地方太突然没有解释导致有一部分挺难受的。总归来说有喜有悲，心疼大臣一秒钟,8,-_无名无铭_-,291396155,9.999596173998777
3716,6,作为一个奇幻故事很不错,10,ahdiua,22538140,9.125090199536265
3717,4,今天跟朋友去看的这部电影，个人感觉，真的很不错！！！,10,ZouEX,687651634,8.762867341231436
3718,5,巨好看啊啊啊啊玲草好好磕,10,薰嗣研究人员,26627649,5.002092623290894
3719,5,首先看了下评论，我也要承认剧情有漏洞。但是整体上还是比较suki。大部分的伏笔都与后面有照应，了解相关背景信息并且推理之后，其实像凳子缺腿这些问题都一目了然，象征意义很大，而且铃芽和草太真的有磕到耶,10,云萧只会咕咕咕,40683339,0.8926029696275406
3720,5,刷了两遍，总之看完之后很喜欢画面和音乐，全片是放松去看的，所以也没有对剧情太在意，感觉如果全身心跟剧情走会感觉很这部作品挺好的（不带脑子?）就是确实有些地方没交代多，我认为是留白（好多人都说没交代好）,10,Bysea_,383259726,6.04300410856238
3721,5,不亏是新海诚,10,火の使者,440395114,5.3369053288283395
3722,5,新的主题，自我救赎，很好,10,求知若饥虚心若愚-,327486434,9.861593333220915
3723,5,我真的很喜欢纯爱……,10,鸭鸭风暴,360738320,9.255260833800028
3724,5,还行，挺好看的，第一个去电影院看的,10,小杨死神,678459609,4.614714762203009
3725,6,一点个人的看法是：缝合怪，但是缝的很不错！在里面仿佛看到了幽灵公主的山神，风之谷的巨神兵；也有些较为勉强的剧情，当然也有很不错的伏笔；不过综上所有，希望大家都能渡过自己的低谷，说出一句：我出发啦！,8,时光不再未来荏苒,24855647,9.996438500151536
3726,5,呜呜!我的猫猫,10,该怎么摸鱼呢,511628791,8.2051282051282
3727,6,好看，精彩,10,九垂虹,189708055,9.189021322338636
3728,5,个人认为挺好看的，音乐衔接的挺好,8,七咲逢赛高,325489053,9.270067538384447
3729,5,不愧是新海诚，鸡皮疙瘩掉一地，真的很棒（词穷不知道怎么才能表达我的哇塞）,10,月球相良,647419768,8.86948884930338
3730,5,好看并感动，新海诚和洋次郎从不让人失望,10,王中王之猪,545906624,9.924732822641015
3731,4,看过之后感觉深刻，新海诚真的很厉害,10,一个好心的良民,1441822452,9.522949168369385
3732,5,剧情一定漏洞 一些节奏不是很好,8,Mr_Hyprt,456911671,2.6329776863496033
3733,5,真的真的特别好看,10,chinako桑_,381857197,8.348875394914714
3734,5,很棒的作品，非常好看,10,静冷atu,442264657,9.743675660494112
3735,6,美术90 剧情85 配乐87  非常多的不同场景高水准镜头，蚓厄盘踞在东京上空那一块配乐特别的有压迫感。虽然缺少突出的泪点与燃点，但观感异常的舒适。演出优秀，人物塑造鲜明，是一段令人羡慕且难忘的旅途,8,昨夜的星鸣,8482895,9.999999547846583
3736,5,真的很喜欢自我救赎，小铃芽真的好勇敢…,10,Pastery樱汐_,41123661,9.866293961769689
3737,6,深度评价就算了，没那个本事，但是在电影院看是真的很震撼,10,花枝鼠花生,6693409,8.157314263055488
3738,5,在电影院看的很震撼。差强人意吧,10,嘎嘎被鲨,352357090,4.474884174770429
3739,5,真的很好看 而且音乐很好听 高潮部分直接起鸡皮疙瘩 我和我妹一起看的 虽然开头十秒全影院尴尬,10,夏飞辞awa,543244566,0.6146595080356199
3740,4,意料之中，可能是期望毕竟高？,8,Bohemien_29,1909914680,8.985363525786838
3741,5,和四五个哥们一起去看的，看完之后达成共识的问题只有一个：这椅子腿咋没的啊？少的一分是少的椅子腿，这个伏笔不填我浑身难受,8,_十六里河_,478614130,1.7883703290609787
3742,5,半夜哭在影院里了，幸好人少,10,扬帆QH,350954926,7.941892294887893
3743,5,那黑猫的背景呢,10,-明河,472600068,7.378531725365568
3744,4,很值得一看。,10,斯蒂芬森-尼恩,1319544540,8.891797587839873
3745,5,还是相当不错的，不过刚看完没咋看懂哈哈哈，看完解读才明白,10,红月下的姑获鸟,399461937,2.149346634826801
3746,4,主要是写向东京311大地震的灾难片，不过新海诚没有去大范围地宣传，所以很多311大地震的受害者都回忆起了曾经的恐惧，就使这部作品在日本十分有争议,10,铁勺子,39271500,9.82608227669001
3747,5,电影还行，但是电影院里的人不行。,8,tatataTenkinoKo,550654087,3.14384380899821
3748,5,牛逼！！！！！！！！！！！！！！！！！！！！！！！！！！！！！！！！！！！！！！！！！！！！！！！,10,坠入黄昏暮云间,395261145,1.8381840219089363
3749,4,新海  诚，yyds,10,朱朱ちゃん,92084422,6.232054202849596
3750,5,今天在影院看的，虽然感觉铃芽的故事线有些突然，但的确是一部不错的作品,8,我永远爱Asuka_,515374607,5.075665118072774
3751,4,好好好（说个题外话，秒速五厘米视角是男主，你的名字是女主，天气之子是男主，铃芽之旅是女主，那下部是男主吧）,10,雨打芭蕉枇杷霜,110737175,1.9168067644112574
3752,5,叙事能力比天气之子好，完成度比天气之子低,10,24岁是美联储,1466878303,9.690611551475563
3753,5,画面音乐感情都很棒！！虽然剧情设定感觉有一点点小问题但是整体超喜欢TT,10,橘橘橘桉,473894898,9.95675222335867
3754,5,我觉得还是挺不错的，主要是女主太帅了,10,mtobdvlb,366523370,9.486087932005534
3755,4,整体还是可以的，剧情叙事有点不尽人意，感情线真的，有点不好。但音乐真的十分可以，画面也还不错。感觉四星有点太多，三星又有点少了，所以看在新海诚的面子上，还是打四星吧！,8,鞦風萧瑟,1540886169,9.880509978620127
3756,5,画面满分，音乐满分，剧情个人感觉还行，我把期待值拉的太低了。,8,黑白羊Hbt,289370664,9.550003738205682
3757,5,这其实是诚哥最温柔的一部作品了吧，尤其是考虑到诚哥在最初企划的时候，是希望将这部片子给写双女主公路旅行题材的，可以看出诚哥有意在跳出大众对于自己爱情导演的限定里，希望大家一定要去欣赏这个全新的新海诚啦,8,clockworkcalling,482228637,9.997399971577538
3758,5,除你的名字外最好看的一部！,10,夜星季旋,383236660,7.510931208388502
3759,6,剧情不行不如你的名字和天气之子,10,Onmyoji不知火,396302664,4.5259025780322535
3760,5,画风音乐挺好，但是剧情就很牵强，对男主一见深情还好，但是还跟自己姨妈怼，还要说什么自己又不要她养，讲一些不负责任的话，总之看的最有感觉的反而是大臣,4,星汰,646035002,0.7707538438485484
3761,5,很好看，特效绝对是三部曲里面的最强！,10,御通,701944392,9.071696769051044
3762,5,是诚哥擅长的，下次想看不一样的…,10,叼住时针,5676659,2.9477378796702816
3763,4,没问题，看就对了,10,丷雷电法王丷,499083782,4.785433599604367
3764,5,《你的名字》对抗灾难《天气之子》适应灾难《铃芽户缔》灾后救赎。铃芽的前半部分是女主弥补她拔出要石的错误，后半部分是女主鼓励小时候的自己。爱情元素堪堪及格，但是作为灾难三部曲结尾，立意深刻，可称佳作。,10,你干嘛哎哟O,383239933,6.938571833050192
3765,5,不懂的人有难了,10,lina_ai,343886752,5.964549628803163
3766,4,新海诚导演的大陆之行，其实还是让很多影迷想一赌风采，我们群里都炸了。说实话，铃芽之旅确实比起以往的，可能没有达到预期效果，但整体还是好看的，铃芽和草太的爱情，关于拯救，拯救世界，拯救草太。,8,纵子哥,264801627,5.1208697324992025
3767,5,只能说还行吧，和前两部比差远了，剧情节奏很怪，甚至有些恋爱脑的感觉，从影院出来懵懵的，不知道该说些什么,4,橘色长衫,478429905,0.007437264655063558
3768,6,虽然爱情线略显突兀但也不是圆不回来，另外铃芽开头去找草太还真不是恋爱脑而是有伏笔的。抛开这俩可谓神中神的作品，强烈推荐！,10,霜影月磐,51276146,3.027891730845411
3769,6,最低只能给1星，不然我给0星,2,天亮再起床,18070226,0.012401051854182832
3770,6,我认为新海诚叙写的既不是亲情线也不是爱情线，而是一个短暂而复杂的人生旅途。人的情感就是这样错综复杂但又似乎很简单——亲情、爱情、友情、勇气、经验感悟以及自我救赎…画面场景音乐就不必多说了，很绝。,10,PSYCHE-06,77045030,9.99999971343941
3771,5,彳亍！个人感觉还是挺好看的，毕竟我没带脑子，期待诚哥的下一个三年之约吧！,10,嫌弃你ヾ,1989666778,9.935493841681968
3772,6,开头埋下的伏笔结尾呼应后感觉怪怪的，这应该不是穿越时空之门才对吧，其他总体还行,8,one-piece铃,45584939,8.114607821965986
3773,6,我觉得，剧情节奏还是有问题，但是相比于前两部，这部动画的立意可是强太多了。。这部电影就不应该打标签标为爱情动画。新海诚系列的作画配乐还是那股味，一流水准。为啥就不能夏天上映呢，一股子夏天味道。,10,丶爱莉希雅丶,124063662,6.313099322292054
3774,5,很有意思,10,九三式纯氧鱼雷,405843845,9.185937938142125
3775,5,在首映影院的那个影厅看的，好滴很捏,10,ime朝闻道,178439217,6.43368330016763
3776,5,包场亲测好看，看各位语文功底了！,10,Doncic77MR,199646829,3.634134683056751
3777,5,给我感觉很好。不过想到命运的轮回，总是有东西在为我们遮挡灾厄，如果只能救一个人的话另一个人就必须痛苦...这些东西，脑子还是很抗拒，人一定要知足，知足，并且有自知之明。尊重他人，尊重自然，字数不够了。,10,莉妮い,102595881,9.989157438566945
3778,5,好看爱看多看！非常喜欢！！！喜欢大臣！喜欢铃芽！喜欢小椅子（bushi）,10,烦啦烦死啦,479855806,9.945388904053772
3779,5,看完之后抱着电影院的门哭了半天,10,那这个宀,498489986,6.690617407036693
3780,5,想看懂这片子需要丢掉一点点理性 以角色为本 感受人性的弱点和清纯美就可以了 其他的不必深究,6,马宸憨_Official,426088323,9.954615114404108
3781,6,我很喜欢，虽然大家都在骂，但我是真的看完第一遍内心久久不能平复又选了场imax二刷，现在依然上头，里面的每一个人物我都好喜欢，期待下一个三年之约,10,画舫听雨落,86390456,9.999371050416064
3782,5,有前几部的影子，比天气之子好些,8,_大长久_,258093418,9.577038113563747
3783,5,一部十分不错的公路片！,10,钟小洋的玩具,1197220306,8.290516302500366
3784,5,总体来讲，我感觉铃芽可能是怀着一种愧疚的心态跟着草太的,10,御坂-12961,504548767,9.458622017870715
3785,6,还是觉得君名最好看啊，,8,维E的味道,23647160,6.845520099065362
3786,5,三年不枉期待,10,日向阳呔,445666113,7.9662133659819645
3787,5,个人觉得好看,10,黑暗灵水,313004238,7.746107802436924
3788,5,上一部滑坡，这一部雪崩,2,flower-fish,65756527,7.035443946747389
3789,5,真的就是一绝好吧，看完之后 后劲真的很大 尤其是大臣，后面变成了要石，我真的要直接哭死好吧,10,Rampant-__,397372723,9.886245243505007
3790,5,好看，首尾呼应的设计真的很喜欢,10,飒飒的可爱蓝星,433720832,9.946645608681305
3791,5,剧情有点拉，全靠画面撑起来。总体给个4分吧,8,FaceDream,413182233,2.382383058445514
3792,6,感情线不行，画面还是美的,6,怀丶觞,24166199,6.5583432060633795
3793,5,除去感情线都是顶级,10,魂归源,1973252856,8.423876048465925
3794,4,没看先留评（）,10,沉涟之碎,1216060068,2.656647474305953
3795,5,神一般的表现力，神一般的效果，绝对值得一看,10,POPsmooooke,27910935,8.234701130269093
3796,5,没有某些人说的那么不堪吧，虽然有不足，但是享受。这个影片的意义就是让你带着正面的想法和情绪离开电影院，而不是给你挑不足给你找茬，那你还不如不看,10,Phevana,512253592,6.794529625723717
3797,4,反复落泪！！！,10,兔子许愿能成功吗1,517760379,9.792171541363752
3798,4,太喜欢了，三部里面最喜欢的一部，剧情，画面，bgm都太震撼了,10,中个头像行不行,178060422,9.861604617691636
3799,4,已经看了三遍了第一遍没看懂甚至还买了小说真的惊艳到我了上次看到这种电影还是秒速5厘米,10,二次元杂鱼,1112820981,9.298481323522505
3800,6,两个字:急、乱。好像是被人拿刀子追着拍出来的...,6,至夏の六分之一,4960728,1.029773326040746
3801,5,只给4星因为感情线莫名奇妙,8,红温乌龟小唐人,382023791,7.059311432118819
3802,5,我想养一只大臣(´⌒`｡),10,左英曼,433595204,8.882677905117308
3803,5,薄纱！他赖赖的直接薄纱！想看的一定要去电影院看！,10,O鲤V礼O,450664874,8.238127549167906
3804,5,无论是细节，美声，画面，都已经做到了极致。其中的片段，有的让人感到激动，兴奋，让人之奋起。有的则潸然，情感复杂。他无疑是最好的，我会给这部电影很多好的评价,10,何贺先生,551328063,9.999959385856918
3805,5,之前没看过新海诚的作品，仅从我个人在电影院的观感而言不差，甚至是个佳作，我觉得剧情没什么大问题，音效音乐也非常好,10,御坂13359号,1763013304,0.6973587464877573
3806,5,“我知道命如蜉蝣， 死亡如影随形，但我依旧祈祷，但此时哪怕再多一年 再多一日 再多一时也好，我辈仍愿人生得续”除去突兀的爱情描写，整部剧其他部分是完全值回票价的。总之，不要抱高期望去看它会给你惊喜。​,8,一眼鐘你,329074476,9.996368654469448
3807,5,很不错（如果看懂了的话）,10,春与世界,487623365,7.651045768457401
3808,5,很好看哦，并且，看起来，感受也很好，算，神作了吧，可以多看一看哦，品味一下，有很多需要理解的东西,10,超级无敌鱼仔仔,518833486,8.279485093569447
3809,5,电影超级好看，是我人生中第一次二刷的电影,10,断不了的竹子,648476165,9.90315587244024
3810,5,简要概括：这是一部讲女主找妈妈最后发现我妈竟是我自己的故事,10,阿s_jl,1379072114,5.18801396392849
3811,4,铃芽之旅这一部电影很好配乐也很棒，值得一看,10,问寒雨痕,151587975,9.87327257902145
3812,5,不懂铃芽之旅的有难了,10,拆我幼驯染你不要命啦,519418974,4.08384233628226
3813,5,铃芽单推人,10,004不下水不改名,290257629,6.911169415271035
3814,5,画面依旧是新海诚的唯美壁纸风格，正常发挥；音乐好评，延续了之前的高质量；剧情上，那句“没有草太的世界，我很害怕”属实有点突兀，感情线一般。总体上还是不错的,8,不懂人心棉被王,618865366,9.997605214223556
3815,6,nb死了，刷了三遍,10,Rack233,336110724,9.555296140293844
3816,6,看完了，我得去刷几遍你的名字缓一缓,6,萌萌哒的杰杰酱,16084041,9.043750811974974
3817,5,真的很感人,10,Minecraft滑稽菌,535082818,9.432794034011414
3818,5,别惦记着什么“新海诚的灾难文学”了，是好作品但也不是这么夸的啊，电影里重点也没过多没在这个隐喻上，怎么看完电影全是说这方面的啊，还有说新海诚作品是灾难三部曲的，感情你之前看你的名字是去看灾难片去了？,10,刚好有6硬币就改名了,90635940,0.9054893057221369
3819,5,和第一部第二部的情感线是不一样的，这部我觉得拍的是很饱满的，叙事也是逻辑自洽的，个人感觉比天气之子的故事要精彩一些，值得去看。,10,阿柴来口欧气,38135537,9.92029017322471
3820,4,虽然感觉剧情方面不如前两部 但整体来说还是十分不错的 画面也十分优秀 就是感觉男主以本来面貌出场的时间有点儿短 加起来也就不到20分钟,10,别扣掉我的滑铲键,1511070214,1.7356338810720318
3821,4,额啊啊啊啊，怎么说，当时在电影院看的时候真的震惊到我了，我好爱这个片，超级喜欢画面唯美，内容我也喜欢！想当闭门师，wwww,10,懒儿最爱,619426963,5.015393530991199
3822,6,感情线突兀，女主对男主，小姨对女主的感情铺垫太少，还有我买错看的中配，中配大臣喊的铃芽属实让我心理不适，我个人比较喜欢感情细腻的作品，这部观感对我来说不如前两部，在我心里大概及格水平，可能要再看一遍。,6,JETHyde,305124903,0.6324672100482276
3823,6,瑕不掩瑜，非常喜欢,10,来一份海盐芝士大福,22066864,9.999707244809555
3824,5,积极乐观的面对人生吧！总有不如意的东西，把它化作我们行走的动力！,10,一箭纵情,449274392,9.997654776694278
3825,5,虽然有一些剧情不太完整，有一些事情没交代清楚，但总体来说优点大于缺点，很好看！,10,昂不理不不,407778875,5.443943357534588
3826,6,“我就是铃芽的明天​”,10,妄想税w,22039816,5.2776982209877055
3827,6,画风音乐还行，但是剧情太平淡了。给个及格分,6,Magic-浅梦,438088744,0.9492647967980816
3828,5,第一部把我看睡着的动漫电影,2,陌上雨逍遥,360790790,1.7445323317211814
3829,5,从311背景代入，以铃芽心路历程为主线，配上作画配曲，我觉得可以打四星。,8,Ansonlczb,360936948,9.961825136745732
3830,6,音乐和画面都很出色，但是爱情线完全不知道怎么爱上的，整体上感觉太乱太杂让人不知道想表达什么,4,御坂10475号,337089502,9.074228301902934
3831,5,音乐很好，不愧是RADWIMPS，但是我对男女主之间的突然深情不理解,8,明月--栞那,509446409,9.676559381755819
3832,5,不错，剧情乱了点,6,朱古力23,621384053,3.698519102590332
3833,5,音乐画面配音稳定发挥，但是对姨妈还有大臣的刻画不够，导致有些情节略显突兀，最后的高潮部分缺乏前两部的爆点和张力，部分设定太单薄，经不起推敲。个人感觉一部不如一部……,6,每天都在道观的道士,378558156,0.4636797516579305
3834,5,铃芽真的小天使，我永远喜欢铃芽,10,此生唯爱知微,415524790,8.73083082143148
3835,5,画面和音乐一如既往的无敌，能让人全身发麻的程度，但是剧情实在是一言难尽，前半部分主线推的还可以，后面就太仓促了，又想搞亲情又想搞爱情，我的评价是不如前两部,6,何能及君也,375110050,0.3628785369728371
3836,4,非常好看，亲情线很感人,10,花酒斟所思,477764375,9.79124220315745
3837,5,感觉挺好的，不知道怎么这么多人讨厌₍˄·͈༝·͈˄*₎◞ ̑̑,10,不知名的某耗,442102776,3.286345099711574
3838,6,去电影院看了，音乐和画面非常的棒。但是故事太紧促了，男女主感情线一言难尽，整个感觉就是花痴后的恋爱脑，故事发展莫名其妙，快看完了都不知道主题是什么。最后靠煽情挽回局面，点明了大概要说什么，但是不明所以,6,家有逆子喵,19996751,0.0059491944348011305
3839,5,毫无逻辑。我以为是找妈妈的故事，结果中途去救男人了，我又以为是纯爱故事，结果最后把男人放在一边开始完成自我救赎了。我？？？你让我怎么想？你觉得我能怎么想？你觉得人凳恋我会嗑的很开心吗？我能代入的了吗？,2,丶小别兔别又别丶,5844651,3.234813731871582
3840,5,这部作品完美的秉承了新海诚一贯的画风，剧情无可挑剔,10,楓氲,451530303,9.853361140693664
3841,5,开幕雷击！细节满满！剧情紧凑，跌宕起伏！值得一看。,10,一而了之滴Xiaosu,646692539,9.891264865552403
3842,5,今天去看了，意难平,10,弟弟枯了,507120663,6.642169754936834
3843,5,特别特别好看 （个人认为）今天刚刚二刷又想再看一遍了 阿b快点上（,10,hide_on_bush-,291255711,7.585490460972759
3844,5,确实很不错,10,五颜六色d猫,443718694,9.063073612500482
3845,5,去除掉感情线的话是一部好作品，音乐真的特别棒，就是剧情推进很仓促，看似讲了很多，但是什么都没表达清楚，尤其是男女主的感情让人感觉莫名其妙。,8,桑月夜,11184800,9.799712479969198
3846,5,太好看了！喜欢铃芽,10,取名真难567,2142581096,7.065694795167559
3847,5,画面音乐绝对算好的，不过剧情不能算优秀，只能说良好，也算是值得一看的电影,8,旅瞳星恋流子酱,471947625,5.4493456953733155
3848,6,值得一看,10,banxiazi7,51014487,8.258156896396496
3849,6,我不知如何评价，只觉得超棒！,10,大队长_Captain,489185984,9.232853827104593
3850,5,虽然，虚化人物，淡化情节，减轻情节上的冲突，但好看,10,ney_ng,516241424,9.303583512343769
3851,5,个人觉得这是目前新海诚电影系列立意最高的一部，好好感受，可以获得努力生活的动力。,10,浮云尘世闲游,354533097,9.447151262397915
3852,5,好看的，但真没必要讲爱情，主打亲情就好，小铃芽哭的时候很让人感动。男女主相处时间不长，导致女主最后的动力不太足。当然也许国情不同，日本人觉得相处时间够了，毕竟辉夜里面还说小情侣从初吻到sex两个月……,8,我是来安徽旅游的qwq,346768233,9.81586639697247
